oID,PID,CIDX,Poster,Gender,CDate,Cmt,CLike,Date,Time
225099851-1,225099851,1,臺北醫學大學 呼吸治療學系,m,10月31日 18:08,普化 應該 每年 考古 普物 參考 前 一屆,2,2016/10/31,18:08
225099851-2,225099851,2,臺北醫學大學,f,10月31日 22:54,比較 想知道 普生 難度 大概 在哪裡 完全 沒 考古題 啊啊啊,1,2016/10/31,22:54
225099851-3,225099851,3,臺北醫學大學 藥學系藥學組,m,11月1日 02:33,普生 根本 超 考古 我大 一期 90,2,2016/11/1,02:33
225099851-4,225099851,4,臺北醫學大學,m,11月1日 05:49,一別 擔心,0,2016/11/1,05:49
225099851-5,225099851,5,臺北醫學大學,m,11月1日 14:16,感動 居然 還有 人會 擔心 考試 考試 加油 考古題 再看 個書 沒問題,3,2016/11/1,14:16
225099851-6,225099851,6,臺北醫學大學 藥學系臨床藥學組,f,11月1日 17:50,b3 真的假 老師 會出 新 題目 欸 qwq 路過 驚慌失措 大一,2,2016/11/1,17:50
225099851-7,225099851,7,臺北醫學大學 藥學系藥學組,m,11月2日 02:32,b6 新 題目 當時 記得 的確 會出 新 題目 但是 我想 也不 可能 全新 可能 幾題 而已 安 老師 不會 當人,1,2016/11/2,02:32
225099851-8,225099851,8,臺北醫學大學,m,11月2日 11:19,大一 那些 東西 共筆 考古 看看,1,2016/11/2,11:19
225099851-9,225099851,9,臺北醫學大學,m,11月5日 07:57,普化 普物 難普生 比較 難,0,2016/11/5,07:57
225099851-10,225099851,10,臺北醫學大學,m,11月7日 03:16,不難 放心,0,2016/11/7,03:16
225081793-1,225081793,1,臺北醫學大學 醫學系,f,10月29日 04:51,我知道,1,2016/10/29,04:51
225081793-2,225081793,2,臺北醫學大學,f,10月29日 05:19,101,2,2016/10/29,05:19
225081793-3,225081793,3,臺北醫學大學,m,10月29日 05:38,想知道 1,2,2016/10/29,05:38
225081793-4,225081793,4,臺北醫學大學 醫學系,m,10月29日 06:10,求掛,1,2016/10/29,06:10
225081793-5,225081793,5,臺北醫學大學,m,10月29日 10:18,我也 知道,1,2016/10/29,10:18
225081793-6,225081793,6,臺北醫學大學,m,10月29日 12:40,有人 爆出 來了 httpswwwpttccbbsgossipingm1477742041a869html,2,2016/10/29,12:40
225081793-7,225081793,7,臺北醫學大學,f,10月29日 13:54,乾好 噁,0,2016/10/29,13:54
225081793-8,225081793,8,臺北醫學大學,f,10月29日 13:56,黑特 北醫 終極 版有 阿,4,2016/10/29,13:56
225081793-9,225081793,9,臺北醫學大學,m,10月29日 14:32,人帥 真好,0,2016/10/29,14:32
225081793-10,225081793,10,臺北醫學大學,m,10月29日 14:41,怎麼 知道 有沒有 偷拍 看過 接近 女友,0,2016/10/29,14:41
225081793-11,225081793,11,臺北醫學大學,f,10月29日 15:15,是否 爆料 公社 爆個,2,2016/10/29,15:15
225081793-12,225081793,12,一個把回應刪除的同學,o,10月30日 12:02,已經 刪除 內容 就像 dcard 一樣 錯過 無法 相見,0,2016/10/30,12:02
225081793-13,225081793,13,臺北醫學大學,f,10月30日 15:20,想知道 哪個人 渣 1,0,2016/10/30,15:20
225081793-14,225081793,14,臺北醫學大學,f,10月31日 00:54,b13,6,2016/10/31,00:54
225081793-15,225081793,15,臺北醫學大學,f,10月31日 03:50,b14 真的是 超多 共同 好友 耶 而且都 女的,3,2016/10/31,03:50
225081793-16,225081793,16,臺北醫學大學,m,10月31日 09:32,都上 新聞 報警 ㄇ 還是 北醫 輔大 化 ㄏ ㄏ,1,2016/10/31,09:32
225081793-17,225081793,17,臺北醫學大學,f,10月31日 16:20,b15 共同 好友 超多 正妹 1b16 好像 已經 報警,4,2016/10/31,16:20
225081793-18,225081793,18,臺北醫學大學,f,11月4日 09:58,我有 好友 可是 我不是 正妹 普到 一個 不行,1,2016/11/4,09:58
225081793-19,225081793,19,一個把回應刪除的同學,o,11月7日 11:28,已經 刪除 內容 就像 dcard 一樣 錯過 無法 相見,0,2016/11/7,11:28
225077333-1,225077333,1,臺北醫學大學,f,10月28日 16:47,怎麼 聽說 之後 搬到 美食街 裡面,2,2016/10/28,16:47
225077333-2,225077333,2,臺北醫學大學,f,10月29日 01:03,真的 不知道 ω,0,2016/10/29,01:03
225077333-3,225077333,3,臺北醫學大學,m,10月29日 13:09,其實 原野 社印 東西 外面 貴 欸,1,2016/10/29,13:09
225077333-4,225077333,4,臺北醫學大學 藥學系,f,11月3日 14:14,原野 社的 阿姨 有說 搬進 美食街 裡面 喔,0,2016/11/3,14:14
225050912-1,225050912,1,臺北醫學大學,m,10月24日 16:02,問後棟 1 樓 那是 醫學系 櫃子,1,2016/10/24,16:02
225050912-2,225050912,2,臺北醫學大學,f,10月24日 16:30,有些 系上 系櫃 問問 學長 姐 也有 那種 密碼 鎖的 收費 標準 好像 寫在 櫃子,1,2016/10/24,16:30
225050912-3,225050912,3,臺北醫學大學,f,10月24日 18:07,確定是 野生 嗎,4,2016/10/24,18:07
225050912-4,225050912,4,臺北醫學大學,f,10月25日 00:12,哪有 野生 這種事,3,2016/10/25,00:12
225050912-5,225050912,5,原PO - 臺北醫學大學,m,10月25日 04:08,b1 棟 一樓 那些 密碼 鎖的 都是 醫學系 嗎,1,2016/10/25,04:08
225050912-6,225050912,6,原PO - 臺北醫學大學,m,10月25日 04:09,b2 瞭解 再去 了解 一下,0,2016/10/25,04:09
225050912-7,225050912,7,原PO - 臺北醫學大學,m,10月25日 04:09,b3b4 哈哈 看起來 感覺 都沒 放 東西 的樣子 呀 xd,0,2016/10/25,04:09
225050912-8,225050912,8,臺北醫學大學,m,10月25日 15:41,那些 都是 雖然 看起來 沒放 東西 都是 歸屬 不同 醫學系 學生 櫃主 發現 裡面 不屬於 他的 東西 佔用 裡面的 東西 是有 可能 丟棄,1,2016/10/25,15:41
225050912-9,225050912,9,原PO - 臺北醫學大學,m,10月26日 15:07,b8 瞭解 謝 每個 系 都有 系櫃 嗎,0,2016/10/26,15:07
225050912-10,225050912,10,臺北醫學大學,f,10月27日 15:26,只有 醫學系 楓杏有 櫃子,0,2016/10/27,15:26
225050912-11,225050912,11,原PO - 臺北醫學大學,m,10月28日 07:25,b10 謝,0,2016/10/28,07:25
225050912-12,225050912,12,臺北醫學大學 醫務管理學系,f,10月28日 15:01,醫管 也有,1,2016/10/28,15:01
225050912-13,225050912,13,臺北醫學大學 牙醫學系,m,10月29日 07:36,牙醫 也有 口腔 醫學 大樓裡,0,2016/10/29,07:36
225050912-14,225050912,14,臺北醫學大學,f,10月31日 15:32,ㄏ ㄏ 其他 系 學生 可憐 櫃子 放 哭哭,1,2016/10/31,15:32
225050912-15,225050912,15,臺北醫學大學,f,10月31日 16:21,b14 不要 這樣 醫學系 也不是 所有人 都有 阿,0,2016/10/31,16:21
225050912-16,225050912,16,臺北醫學大學,f,11月1日 10:24,櫃子 都是 花 租來,1,2016/11/1,10:24
225050912-17,225050912,17,原PO - 臺北醫學大學,m,11月1日 23:34,b16 謝 最近 晃晃 時候 有看到 15030 天,0,2016/11/1,23:34
225050912-18,225050912,18,臺北醫學大學,f,11月4日 09:56,我願意 花錢 只要有 櫃子 每次 上課 都要 家裡 扛 重 死人 書超 不爽,0,2016/11/4,09:56
225050912-19,225050912,19,原PO - 臺北醫學大學,m,11月5日 15:08,b18 真的 超重 qq 家 離 學校 很遠,1,2016/11/5,15:08
225038554-1,225038554,1,臺北醫學大學 藥學系,m,10月23日 01:50,httpmy2tmuedutwboardphpcourseid9105fdocfolderid39715cid394942,0,2016/10/23,01:50
225038554-2,225038554,2,臺北醫學大學,m,10月23日 04:48,嫌棄 幫 妳 感覺 老師 級 只會 妳好 讀書,6,2016/10/23,04:48
225038554-3,225038554,3,臺北醫學大學 藥學系,m,10月23日 05:00,我是 b1 可幫 1 不過 求助者 通常 還是 希望 找 同性 諮商 對象 而且 我認為 專業的 比較好 q 心理諮商 專業 人員 背景 a 北 醫學 輔 中心 心理諮商 專業 人員 背景 具有 專業 證照 諮商 心理 師 臨床 心理 師,0,2016/10/23,05:00
225038554-4,225038554,4,原PO - 臺北醫學大學,f,10月23日 05:08,b1 我去 看過 網頁 可是 覺得 還是 不太 清楚 耶 其實 異性 也可以 只是 擔心 隱私 問題 覺得 專業 人員 給我 比較好 建議 畢竟 同儕 間 年齡 相同 有時候 想法 差不多 也想 知道 不同 價值觀 看法,1,2016/10/23,05:08
225038554-5,225038554,5,臺北醫學大學 醫學系,m,10月23日 06:59,其實 蠻 好奇 幫忙 又要 怎麼 連絡 畢竟 這裡 不是 匿名 制 嗎,1,2016/10/23,06:59
225038554-6,225038554,6,臺北醫學大學,m,10月23日 09:37,我覺得 滿 不錯的 之前 一些 事情 那邊 針對 妳 疑慮 老師 諮商 師人 滿 不錯 可能 見怪不怪 哈 只要有 提出 要求 都會 盡量 滿足 妳 像是 提到 性別 指定 隱私 的部分 我覺得 也還 ok 一開始 會先 由學輔 老師 帶 妳 評估 是否 需要 進一步 尋找 諮商 師而 諮商 師 諮商 之前 會要 簽 一份 切結書 同意 諮商 師把 個案 對話 留存 記錄 不是 錄音筆 像 寫 反思 一樣 諮商 師在 諮商 寫 環境 地點 就是 在學 輔中 心裡 一間 小房間 每週 一次 一個小時 事前 準備 妳 想說的 準備好 好好的 說給 老師 們 聽 好了 大概 就是 這樣有 問題 再問 祝妳 順利 加油 ryo,5,2016/10/23,09:37
225038554-7,225038554,7,原PO - 臺北醫學大學,f,10月23日 11:56,b6 感謝,0,2016/10/23,11:56
225038554-8,225038554,8,臺北醫學大學,f,10月24日 02:37,學輔 老師 很好 不要 壓力,2,2016/10/24,02:37
225038554-9,225038554,9,臺北醫學大學,f,10月24日 16:44,好想 幫 哀哀 加油,1,2016/10/24,16:44
225038554-10,225038554,10,臺北醫學大學,f,10月26日 07:50,我也 希望 幫 加油,0,2016/10/26,07:50
225036929-1,225036929,1,臺北醫學大學,m,10月22日 16:23,不行 by 泳池 工讀生,5,2016/10/22,16:23
225036929-2,225036929,2,臺北醫學大學 醫務管理學系,m,10月22日 16:26,某棟 大樓 五樓 男廁 好像,1,2016/10/22,16:26
225036929-3,225036929,3,臺北醫學大學,f,10月24日 16:22,跟住 宿舍 或外 租 朋友 借,1,2016/10/24,16:22
225036929-4,225036929,4,原PO - 臺北醫學大學,m,10月24日 17:29,b1 謝謝你 b2 一棟 呀 b3 我沒有 朋友,1,2016/10/24,17:29
225036929-5,225036929,5,臺北醫學大學,f,10月24日 18:29,實驗的 一棟,0,2016/10/24,18:29
225036929-6,225036929,6,臺北醫學大學,m,11月3日 06:19,體育館 一樓 廁所 一間 淋浴 間,0,2016/11/3,06:19
225030276-1,225030276,1,臺北醫學大學,f,10月21日 23:58,大家 加油,0,2016/10/21,23:58
225022223-1,225022223,1,臺北醫學大學 藥學系,m,10月20日 15:10,韓村 廣島 屋,2,2016/10/20,15:10
225022223-2,225022223,2,臺北醫學大學 醫務管理學系,m,10月20日 15:20,阿姨 愛,25,2016/10/20,15:20
225022223-3,225022223,3,臺北醫學大學 公共衛生學系,f,10月20日 15:21,好食 推推 真的 實在,8,2016/10/20,15:21
225022223-4,225022223,4,臺北醫學大學 醫學科學研究所,m,10月20日 15:56,老宋 牛肉麵 饌 屋 大志 軒 honeypig,2,2016/10/20,15:56
225022223-5,225022223,5,臺北醫學大學,f,10月20日 16:52,粥 道 框影 提諾 大紅花,4,2016/10/20,16:52
225022223-6,225022223,6,原PO - 臺北醫學大學 生醫材料暨組織工程研究所,m,10月21日 02:09,b1 謝謝 筆 記起來 b2 認真 店名 b3 謝謝 b4 真多 感覺 不錯 b5 收藏,0,2016/10/21,02:09
225022223-7,225022223,7,臺北醫學大學 呼吸治療學系,m,10月21日 03:17,學餐 阿姨 有道 隱藏 菜色 叫 愛 划算 都有 點 看看,8,2016/10/21,03:17
225022223-8,225022223,8,原PO - 臺北醫學大學 生醫材料暨組織工程研究所,m,10月21日 04:41,b7 哈哈哈 原來如此,0,2016/10/21,04:41
225022223-9,225022223,9,臺北醫學大學,m,10月21日 06:07,沒吃過 祥和 不要 跟我說 讀過 北醫 拜託 祥和 大使,11,2016/10/21,06:07
225022223-10,225022223,10,臺北醫學大學 藥學系,m,10月21日 06:25,海力士 無誤,4,2016/10/21,06:25
225022223-11,225022223,11,原PO - 臺北醫學大學 生醫材料暨組織工程研究所,m,10月21日 07:47,b9 哈哈 已吃過 老師 最愛 之一,0,2016/10/21,07:47
225022223-12,225022223,12,原PO - 臺北醫學大學 生醫材料暨組織工程研究所,m,10月21日 07:47,b10 聽說 找 時間 一次,0,2016/10/21,07:47
225022223-13,225022223,13,臺北醫學大學,f,10月21日 08:32,推 朝鮮 閣,1,2016/10/21,08:32
225022223-14,225022223,14,臺北醫學大學 醫學檢驗暨生物技術學系,f,10月21日 09:08,田園 大蒜 jnf,1,2016/10/21,09:08
225022223-15,225022223,15,原PO - 臺北醫學大學 生醫材料暨組織工程研究所,m,10月21日 11:28,b13 謝謝 b14 田園 吃個 幾次 推 其他 收藏,0,2016/10/21,11:28
225022223-16,225022223,16,臺北醫學大學 藥學系,m,10月21日 13:10,品味 刀削麵 超愛,2,2016/10/21,13:10
225022223-17,225022223,17,原PO - 臺北醫學大學 生醫材料暨組織工程研究所,m,10月21日 13:56,b16ok,1,2016/10/21,13:56
225022223-18,225022223,18,臺北醫學大學,f,10月21日 16:45,陳 根找 茶 台北市 十大 早餐,1,2016/10/21,16:45
225022223-19,225022223,19,原PO - 臺北醫學大學 生醫材料暨組織工程研究所,m,10月22日 03:49,b18 謝謝 實驗室 推薦 找 時間 吃 看看,0,2016/10/22,03:49
225022223-20,225022223,20,臺北醫學大學 藥學系藥學組,m,10月22日 05:30,你們 忘了 mrj 嗎 既然 樓主說 價位 其次 提了,2,2016/10/22,05:30
225022223-21,225022223,21,臺北醫學大學,f,10月22日 06:28,覺得 老爹 廚房 不錯 朝鮮 閣 阿姨 上菜 沒問 開始 拌 石鍋 頓時 食慾 全無,3,2016/10/22,06:28
225022223-22,225022223,22,臺北醫學大學,f,10月22日 06:49,有志 壹同 眷村,3,2016/10/22,06:49
225022223-23,225022223,23,原PO - 臺北醫學大學 生醫材料暨組織工程研究所,m,10月22日 07:21,b20 謝謝 普遍 大家 味道 還好 哈哈 b21 看起來 像 傳統 豬 飼料 嗎 b22 好的 謝謝,1,2016/10/22,07:21
225022223-24,225022223,24,臺北醫學大學,m,10月22日 10:22,聞豆奇 不錯 吃,3,2016/10/22,10:22
225022223-25,225022223,25,臺北醫學大學 醫學系,m,10月25日 18:30,滿 燒肉 丼,0,2016/10/25,18:30
225022223-26,225022223,26,臺北醫學大學 醫學系,f,10月26日 08:11,大蒜 名聲 不太好 喔 哈哈 聽說 之前 餐點 裡面 常常 蟑螂,1,2016/10/26,08:11
225022223-27,225022223,27,臺北醫學大學 藥學系,m,10月27日 19:35,田園 真的 讚 cp 值 極高 薌 不錯 雞腿飯 推 88 茶餐廳 祥和 炒飯 一樣的 感覺 逢江 豆腐鍋 莊敬路 君悅 排骨 對面 推韓 大嬸 韓式 拌飯 真的 也是 好吃,1,2016/10/27,19:35
225022223-28,225022223,28,臺北醫學大學 護理學系,m,11月4日 01:19,l 肉 叔叔,0,2016/11/4,01:19
225022223-29,225022223,29,臺北醫學大學 藥學系,m,11月4日 16:10,怎麼 沒人 推九鬼,0,2016/11/4,16:10
225014582-1,225014582,1,臺北醫學大學,f,10月19日 15:26,最近 好多 黑特版 還有 一個 叫 黑特 北醫 終極 版,9,2016/10/19,15:26
225014582-2,225014582,2,臺北醫學大學,f,10月19日 15:49,不知道 什麼時候 黑特 北醫 開始 走 討論 公共事務 路線 40 根本是 戒嚴 哈哈,3,2016/10/19,15:49
225014582-3,225014582,3,原PO - 臺北醫學大學 藥學系藥學組,m,10月19日 15:52,b1 開始 想要 追蹤 終極 版 b2 真的 啊 發文 黑特 婊小編 根本 不敢 發連 髒話 都不能 罵 還叫 甚麼 黑特,1,2016/10/19,15:52
225014582-4,225014582,4,臺北醫學大學 醫學系,f,10月20日 02:05,b1 推推 終極 版,0,2016/10/20,02:05
225014582-5,225014582,5,臺北醫學大學 呼吸治療學系,m,10月20日 06:57,難道 不知道 醫院 不會有 4 嗎,2,2016/10/20,06:57
225014582-6,225014582,6,臺北醫學大學,f,10月20日 11:13,爆卦 北醫 耶是 有人 看不過去 httpsmfacebookcomgossiptmu,2,2016/10/20,11:13
225014582-7,225014582,7,臺北醫學大學,m,10月20日 13:14,黑特 北醫 50 上線,1,2016/10/20,13:14
225014582-8,225014582,8,原PO - 臺北醫學大學 藥學系藥學組,m,10月20日 13:30,真的 頭昏眼花 目前 存在的 板有 黑特 北醫 黑特 北醫 40 黑特 北醫 50 黑特 北醫 終極 版 爆卦 北醫 北醫 一定 黑 特點 很多 才可以 別人 不一樣 多 超多版 下次 來個 真黑特 北醫 好了,2,2016/10/20,13:30
225014582-9,225014582,9,臺北醫學大學,m,10月20日 13:58,我看 50 就是 看不慣 40 沒 guts 行為 創,1,2016/10/20,13:58
225014582-10,225014582,10,臺北醫學大學,f,10月20日 14:14,那就 原 po 創個 真 黑特 北醫 了了,0,2016/10/20,14:14
225014582-11,225014582,11,臺北醫學大學,f,10月20日 14:24,覺得 一個 終極 版 夠了,2,2016/10/20,14:24
225014582-12,225014582,12,臺北醫學大學,m,10月20日 15:17,髒話 一直都 發阿是 太菜 刪 噗噗,0,2016/10/20,15:17
225014582-13,225014582,13,原PO - 臺北醫學大學 藥學系藥學組,m,10月20日 15:41,b12 可能 罵 太狠 不敢 發,0,2016/10/20,15:41
225014582-14,225014582,14,臺北醫學大學 醫學系,f,10月26日 08:11,為什麼 要有 那麼多 版本 啊,0,2016/10/26,08:11
225014582-15,225014582,15,臺北醫學大學,m,10月29日 14:03,b14 40 這個 不能 寫 那個 不能 寫連 髒話 都不能 寫 戒嚴 差不多 出現 其他的 版,0,2016/10/29,14:03
225012678-1,225012678,1,臺北醫學大學 藥學系,m,10月19日 12:25,莊敬路 快要 麥當勞 一家 推薦 吳興街 吳興 商圈 走過 十字路口 之後 也有 幾家,2,2016/10/19,12:25
225012678-2,225012678,2,原PO - 臺北醫學大學 醫學科學研究所,f,10月19日 16:20,感謝,0,2016/10/19,16:20
225012678-3,225012678,3,臺北醫學大學 96醫學系,m,11月11日 00:16,晚 才看到 不過 分享 數年 前 經驗 吳興街 那家修 別的 東西 好像是 腳架 有點 忘記 結果 牽 沒 多遠 整組 變速 掉下來 後來 寧可 牽去 台大 裡面 那間 不需 零件 還會 免費 還有 台大 後門 辛亥路 某家 借過 工具 免費,0,2016/11/11,00:16
224980958-1,224980958,1,臺北醫學大學 藥學系藥學組,m,10月15日 04:42,階段 國考 三大 科目 及格 考 像是 藥理 藥化 藥劑 生藥 藥分 參加 二階 資格 藥學系 畢業,1,2016/10/15,04:42
224980958-2,224980958,2,原PO - 臺北醫學大學 藥學系藥學組,m,10月15日 05:25,b1 謝謝你 啊 有看到 文說 醫學系 普化 沒過 不能 考國考 才想 問問看 想說 藥學系,0,2016/10/15,05:25
224980958-3,224980958,3,臺北醫學大學 藥學系,m,10月15日 08:40,補充 b1 因為有 機 可能會 檔 修到 藥化 你在 大三 暑假 前 無法 修過 所有 國考 科目 辦法 考國考 第一 階段 修過 藥理學 藥物 化學 生 藥學 藥物 分析 藥劑學 生物 藥劑學,1,2016/10/15,08:40
224980958-4,224980958,4,臺北醫學大學 藥學系藥學組,m,10月15日 13:43,原 po 加油 一起 考 一階,1,2016/10/15,13:43
224980958-5,224980958,5,原PO - 臺北醫學大學 藥學系藥學組,m,10月15日 13:52,b3 現在 都沒有 擋修 哦 之前 問過 好險 好險,0,2016/10/15,13:52
224980958-6,224980958,6,臺北醫學大學 藥學系,m,10月22日 14:23,學長 有機 下藥 化上 當了 有心 都過 甚至 順利 通過 國考 加油,0,2016/10/22,14:23
224980958-7,224980958,7,原PO - 臺北醫學大學 藥學系藥學組,m,10月22日 16:19,b6 既然 修 過藥 化了 怎麼 可能會 叫 學長 應該是 同學 笑,0,2016/10/22,16:19
224973943-1,224973943,1,臺北醫學大學 醫學系,f,10月14日 05:56,幫 抓 兇手 qq,3,2016/10/14,05:56
224954657-1,224954657,1,臺北醫學大學 公共衛生學系,m,10月11日 15:52,剛剛 看過 qq 學生證 給 櫃檯 幫 減一 點錢 不過 還是要 260,2,2016/10/11,15:52
224954657-2,224954657,2,臺北醫學大學,f,10月11日 16:08,附近 診所 一堆,1,2016/10/11,16:08
224954657-3,224954657,3,臺北醫學大學 牙醫學系,f,10月11日 16:29,建議 小病 診所 就好 不要 醫院 浪費 健保 資源 唷,17,2016/10/11,16:29
224954657-4,224954657,4,臺北醫學大學,m,10月12日 05:27,基本 自費 負擔 外面 掛號費 貴 啊,0,2016/10/12,05:27
224954657-5,224954657,5,臺北醫學大學,m,10月12日 06:19,買 普拿疼 吃 吃 好啊 xd 反正 也是 差不多的 藥,2,2016/10/12,06:19
224954657-6,224954657,6,臺北醫學大學 醫學檢驗暨生物技術學系,f,10月12日 09:45,事實上 醫院 的藥 可能 還比 外面 差,0,2016/10/12,09:45
224954657-7,224954657,7,臺北醫學大學,f,10月13日 13:35,小病 外面 診所 好了 喔 不要 浪費 健保 資源 啊 比較 省錢 真的 身為 醫學 大學 學生 應該 了解 醫療 分級 落實 唷,4,2016/10/13,13:35
224954657-8,224954657,8,臺北醫學大學,f,10月13日 15:38,借 請問 北醫 附近 推薦 診所 嗎,0,2016/10/13,15:38
224954657-9,224954657,9,臺北醫學大學,m,10月13日 16:06,b8 六張犁 那邊的 安吉 耳鼻喉科 不錯,0,2016/10/13,16:06
224954657-10,224954657,10,臺北醫學大學 牙醫學系,m,10月13日 16:24,靠近 信義國中 有間 信義 耳鼻喉科 還不錯,0,2016/10/13,16:24
224954657-11,224954657,11,臺北醫學大學,f,10月16日 15:03,學生 優惠 免去 掛號費 150 元 基本上 民眾 附醫 最低 基本 價是 150240390 元 學生 大多是 240 若是 還有 其他的 藥事費 處置 費則 另計 雖然 只比 外面 診所 多 4090 元 落實 醫療 分級 制度 建議 外面 就診 並且 也不會 等到 天荒地老 好好 珍惜 台灣 醫療 資源 啊,3,2016/10/16,15:03
224954657-12,224954657,12,臺北醫學大學,m,10月16日 17:17,每次 感冒 都去 麥當勞 斜對面 劉彥 煌 耳鼻喉科 看醫生 nice,0,2016/10/16,17:17
224954657-13,224954657,13,臺北醫學大學,m,10月21日 17:21,讚 成 b3 成藥 傷身 傷胃 建議 診所 就行了 本身 一直 喝熱 開水 偶爾 薑母茶 稍微 運動 出個 汗 記得 擦乾 痊癒,0,2016/10/21,17:21
224949246-1,224949246,1,臺北醫學大學 藥學系,m,10月11日 07:19,爛 玻璃屋 低能 玻璃屋 腦殘 玻璃屋,8,2016/10/11,07:19
224949246-2,224949246,2,臺北醫學大學 牙醫學系,f,10月11日 09:46,為什麼 要蓋 玻璃屋,1,2016/10/11,09:46
224949246-3,224949246,3,臺北醫學大學 保健營養學系,f,10月11日 10:04,為了 賣 咖啡 紀念品,3,2016/10/11,10:04
224949246-4,224949246,4,臺北醫學大學 牙醫學系,f,10月11日 10:18,b3 認真 嗎,0,2016/10/11,10:18
224949246-5,224949246,5,臺北醫學大學,m,10月11日 11:42,怎麼 不開間 鬆餅 屋 台大 小木屋 鬆餅 好吃,29,2016/10/11,11:42
224949246-6,224949246,6,臺北醫學大學,f,10月11日 14:50,推 b5 鬆餅 屋,0,2016/10/11,14:50
224949246-7,224949246,7,臺北醫學大學,f,10月11日 15:28,這樣 也要 叫 一個 樓還 動土 儀式 不知道 的還 以為是 教學用 大樓 ㄏ ㄏ,1,2016/10/11,15:28
224949246-8,224949246,8,臺北醫學大學,m,10月11日 15:51,b6 推 啊 超級 好吃,1,2016/10/11,15:51
224949246-9,224949246,9,臺北醫學大學 藥學系藥學組,m,10月12日 02:20,到底 蓋來 幹嘛 啊,1,2016/10/12,02:20
224949246-10,224949246,10,臺北醫學大學,f,10月12日 05:10,我還 真的 以為是 教學 大樓,0,2016/10/12,05:10
224949246-11,224949246,11,原PO - 臺北醫學大學,m,10月12日 12:03,今天 經過 還有 聽到 好像 媒體 記者 休閒 空間 採訪 前,1,2016/10/12,12:03
224949246-12,224949246,12,臺北醫學大學,f,10月13日 08:10,乾 學校 有錢 蓋腦 殘 玻璃屋 沒錢 增加 櫃子 數量 想要 系櫃 小系 沒 人權 qq,4,2016/10/13,08:10
224949246-13,224949246,13,臺北醫學大學 藥學系藥學組,m,10月13日 15:16,簡單 來說 就是 學校 拿來做 公關,0,2016/10/13,15:16
224949246-14,224949246,14,臺北醫學大學,f,10月14日 04:10,我也 想要 系櫃 乾 小系 沒 人權 qq,2,2016/10/14,04:10
224949246-15,224949246,15,原PO - 臺北醫學大學,m,10月14日 07:42,拍拍 小系,0,2016/10/14,07:42
224949246-16,224949246,16,臺北醫學大學 藥學系,m,10月19日 14:27,君蔚 是誰 啊,0,2016/10/19,14:27
224949246-17,224949246,17,臺北醫學大學,m,10月21日 06:09,蓋 一間 一點 圖書館 其實,0,2016/10/21,06:09
224948952-1,224948952,1,臺北醫學大學 藥學系,f,10月11日 01:51,真 ㄉ 假 ㄉ,1,2016/10/11,01:51
224948952-2,224948952,2,臺北醫學大學,m,10月11日 01:59,三人行 必有 濕焉誤,12,2016/10/11,01:59
224948952-3,224948952,3,臺北醫學大學,m,10月11日 09:13,求 詳細,0,2016/10/11,09:13
224948952-4,224948952,4,臺北醫學大學,m,10月12日 06:18,這樣 不是 正常 嗎,2,2016/10/12,06:18
224948952-5,224948952,5,臺北醫學大學,m,10月12日 12:34,台大 男宿 兜 一圈 再回來 或是 playone,1,2016/10/12,12:34
224944893-1,224944893,1,臺北醫學大學 牙醫學系,m,10月10日 13:29,我也 無奈 啊 哈哈哈哈 大家 好像 覺得很 正常 還很遠,1,2016/10/10,13:29
224944893-2,224944893,2,臺北醫學大學,m,10月10日 13:57,恩 應該 大部分 不懂 妳的 標題,1,2016/10/10,13:57
224944893-3,224944893,3,臺北醫學大學,m,10月10日 14:15,網路上 其實有 整份 國內 名單 北醫 的部分 不少 無奈,2,2016/10/10,14:15
224944893-4,224944893,4,臺北醫學大學,m,10月10日 14:40,嚴重 在哪裡 啊 會出 國的 素質 比較 低 你們 滿意 還是 搶 你的 飯碗 不爽 你有 認真 看過 出國 學的 東西 嗎 比較 紮實 嗎 還是 也是 考試 作弊 考試 為了 應付,1,2016/10/10,14:40
224944893-5,224944893,5,臺北醫學大學 牙醫學系,m,10月10日 14:44,b4 也沒有 不爽 啊 不要在 考試 輸 就好 只是 看到 這麼 拼 然後 高中 同學 每天 混 拿個 50 級分 出國 念牙 還是 有點 不平衡 只怪 出身 沒 努力,7,2016/10/10,14:44
224944893-6,224944893,6,臺北醫學大學 藥學系,m,10月10日 16:08,副校長 女兒,0,2016/10/10,16:08
224944893-7,224944893,7,臺北醫學大學,m,10月11日 03:09,級分 真的 重要 嗎 還是 重要 你們 五六年 學的 知識 不要 每個 抬頭 覺得 神 一樣 然後 學習 太度 待人 都很 差 多數人 還是 很棒 覺得 你們 complain 很多 別人 背景 誰 誰 誰 副校長 兒女 他媽的 別人 還是 努力的 學 啊 不要 進個 醫牙 高潮 有本事 就拿出 實力 證明 即使 背景 我不 相信 實力 會輸 不喜歡 聽 你們 那邊 靠北 有的 沒有的 生病 還是 你們 加油 點 好嗎,7,2016/10/11,03:09
224944893-8,224944893,8,臺北醫學大學 牙醫學系,m,10月11日 07:42,b7 歡迎 ptt 發表 喜歡 你的 觀點 應該 也是 醫牙,1,2016/10/11,07:42
