oID,PID,CIDX,Poster,Gender,CDate,Cmt,CLike,Date,Time
224047997-18,224047997,18,臺北醫學大學,f,5月24日 18:17,沒 有人說 宿舍 b1 樓梯 嗎 晚上 去過 一次 兩邊 都有 情侶 qaq,2,2016/5/24,18:17
224047997-19,224047997,19,臺北醫學大學,f,6月17日 03:47,建議 不要 信義國中 當地 居民 不安全,1,2016/6/17,03:47
224047997-20,224047997,20,原PO - 臺北醫學大學 ,f,6月17日 10:43,b18 那邊 不是 人來人往 嗎 b19 欸 喔 可能 白天 應該 還好 哈哈,0,2016/6/17,10:43
224047997-21,224047997,21,臺北醫學大學,f,9月14日 05:12,惠安 公園 學校 附近 很近 地方 很美 google 爬上 一個 小坡 那裡 101 室個 地方 不要 周四 下午 學校 老師 們 會在 那裡 出現 老師 健 走,1,2016/9/14,05:12
224047717-1,224047717,1,臺北醫學大學 保健營養學系,f,5月19日 16:34,真假 我也 很愛 家,0,2016/5/19,16:34
224047717-2,224047717,2,臺北醫學大學,m,6月30日 17:56,好吃 欸 斜對面 不是 一間 咖啡色 比較好 吃,0,2016/6/30,17:56
224046830-1,224046830,1,臺北醫學大學,f,5月19日 05:01,想知道 加一 希望 是個 便宜 又有 很多 歌唱 地方 xd,1,2016/5/19,05:01
224046830-2,224046830,2,臺北醫學大學,f,5月19日 05:07,唱歌,1,2016/5/19,05:07
224046830-3,224046830,3,臺北醫學大學,f,5月20日 05:20,去過 超 可怕 推,1,2016/5/20,05:20
224046830-4,224046830,4,臺北醫學大學,f,5月20日 05:22,到底 誰 想去 那種 地方 啊,0,2016/5/20,05:22
224046830-5,224046830,5,臺北醫學大學,f,5月23日 10:26,感覺 像是 正常 唱 ktv 地方,0,2016/5/23,10:26
224046830-6,224046830,6,臺北醫學大學 護理學系,m,5月25日 02:29,送 便當 進去 過那 就是 所謂的 小吃部 卡啦 ok,0,2016/5/25,02:29
224046830-7,224046830,7,臺北醫學大學,m,6月30日 17:57,b3 那是,0,2016/6/30,17:57
219969496-1,219969496,1,臺北醫學大學,f,5月16日 14:59,8101,0,2016/5/16,14:59
219969496-2,219969496,2,原PO - 臺北醫學大學 藥學系藥學組,m,5月16日 16:16,b1 謝謝你,0,2016/5/16,16:16
219969496-3,219969496,3,原PO - 臺北醫學大學 藥學系藥學組,m,5月17日 15:27,b1 請問 一下 只有 中午 時段 嗎,0,2016/5/17,15:27
219969496-4,219969496,4,臺北醫學大學,f,5月19日 09:05,只有 中午 喔,0,2016/5/19,09:05
219969496-5,219969496,5,原PO - 臺北醫學大學 藥學系藥學組,m,5月21日 06:40,b4 謝謝 喔 昨天 拿到,0,2016/5/21,06:40
219168811-1,219168811,1,臺北醫學大學,f,5月16日 07:34,我有 朋友 朋友 疑似 某個 地方 看過 不過 確定是 不是 個人 是在 教研 看到,3,2016/5/16,07:34
219168811-2,219168811,2,臺北醫學大學,m,5月16日 14:08,我的 錢包 禮拜 之夜 掉了 oao,0,2016/5/16,14:08
209000997-1,209000997,1,臺北醫學大學 藥學系藥學組,m,5月13日 08:50,哈哈 還滿 可愛的 畫風,2,2016/5/13,08:50
202682664-1,202682664,1,臺北醫學大學 醫學系,f,5月10日 16:46,只有 學期 喔 搶 便當 達人,0,2016/5/10,16:46
202682664-2,202682664,2,臺北醫學大學 保健營養學系,f,5月10日 23:22,保健 便當 三上 實驗 課 做的 只有 學期 喔,1,2016/5/10,23:22
202682664-3,202682664,3,臺北醫學大學 保健營養學系,m,5月11日 02:29,學弟 看來 還是 菜鳥 哈哈哈 去年 還是 前年 吃了 好吃 想要 搶 保健 便當 快跟 保健 便當 只有 學期 保三 團膳 才會有 喔 xdd 滷 糖,7,2016/5/11,02:29
202682664-4,202682664,4,原PO - 臺北醫學大學 藥學系藥學組,m,5月11日 10:29,謝謝 回答 學期 繼續 搶,0,2016/5/11,10:29
202682664-5,202682664,5,臺北醫學大學 保健營養學系,m,5月30日 14:00,我也 喜歡 保健 便當 煮飯 組,0,2016/5/30,14:00
202473913-1,202473913,1,臺北醫學大學 護理學系,m,5月11日 02:59,直接 打去 問 通識 中心 去年 也是 日檢 證書 申請 後來 也有 我過 資格 但是 順位 好像會 排在 後面 不過 最後 拿到 獎金 就夠 哈哈,0,2016/5/11,02:59
194572318-1,194572318,1,臺北醫學大學,f,5月8日 05:45,聽說是 今年 難道 不是 今年,2,2016/5/8,05:45
194572318-2,194572318,2,臺北醫學大學,m,5月8日 07:20,gg 北醫 學店 化 還好 我快 畢業,9,2016/5/8,07:20
194572318-3,194572318,3,原PO - 臺北醫學大學 ,f,5月8日 08:15,b1 今年 開 醫學 工程系,3,2016/5/8,08:15
194572318-4,194572318,4,臺北醫學大學,f,5月8日 08:33,b2 聽 這麼說 是不是 應該 辦理 休學 轉校 我想 聽 細節 這方面 卦,1,2016/5/8,08:33
194572318-5,194572318,5,臺北醫學大學,f,5月8日 09:06,今年 食安,2,2016/5/8,09:06
194572318-6,194572318,6,臺北醫學大學 保健營養學系,m,5月8日 15:51,今年 開的 食品安全 學位 學程 明年 新設 營養學 院 食品安全 學系 然後 這樣 算是 八卦 嗎,2,2016/5/8,15:51
194572318-7,194572318,7,臺北醫學大學,m,5月9日 01:51,學士學位 學程 嗎 其實 就是 學系,1,2016/5/9,01:51
194572318-8,194572318,8,臺北醫學大學 保健營養學系碩士班,f,5月14日 02:04,保健 系 老師 們 籌辦 意見 嗎,1,2016/5/14,02:04
194572318-9,194572318,9,臺北醫學大學,m,5月14日 15:10,b9 這麼多 系是 幹嘛 學校 考慮到 這些人 以後 畢業 失業 嗎,3,2016/5/14,15:10
194572318-10,194572318,10,臺北醫學大學 保健營養學系碩士班,f,5月14日 16:44,b9 要不要 先 了解 一下 食安 系 成立 宗旨 當然是 為了 順應 社會 需求 也許 現在 需求量 不高 也是 未來 可能會 越來越 重視 食安 問題 才想 成立 阿 不然 北醫 嘰 沒事 成立 用不到 系 幹什麼 而且 確定 這些 同學 畢業 一定會 失業 有時候 發展 的問題 沒 有人說 北醫 一定要 產出 證照 考的 人才 能不能 擁有 積極 態度 貢獻 這個 社會 才是 重點,4,2016/5/14,16:44
194572318-11,194572318,11,臺北醫學大學 保健營養學系,m,5月14日 17:05,b9 請問 你的 邏輯 死了 嗎 學校 多開 系 畢業 失業 了不起 因果關係 嗎 請問 參考 文獻 要不要 附 一下 rf 看看 不管 那個人 系 都會 找到 屬於 他的 出路 我想 還是 擔心 你自己,6,2016/5/14,17:05
194572318-12,194572318,12,臺北醫學大學,m,5月15日 06:03,其實 待 超過 十年 就知道 這是 學校 慣用 伎倆 呵呵,0,2016/5/15,06:03
194572318-13,194572318,13,臺北醫學大學,m,5月17日 04:27,b10 啊 各種 宗旨 都是 感動 人心 不創 不行 否認 這個 需求 但有 需求 能否 市場 又是 一個 問題 貢獻 社會 當然 很好 但是 北醫 畢竟 經營 業績 壓力 創系 是為了 賺錢 誰 相信 創系時 證照 市場 等等 都能 差不多 時間 準備好 這樣 不是 完美 嗎 b11 遺憾 很多 系 只是 學校 招生 賺錢 工具 如同 樓上 所說 畢業 失業 的問題 難過 看看 醫牙藥 畢業 起薪 缺 額數 營養師 起薪 缺額 比較 懂 我的 邏輯,0,2016/5/17,04:27
194572318-14,194572318,14,臺北醫學大學,m,5月18日 15:17,北醫 才不是 學校 賺錢 醫院 賺錢 學校 這個 機構 好用 許多 有趣的 妙用,0,2016/5/18,15:17
194572318-15,194572318,15,臺北醫學大學,m,5月21日 13:42,醫療 人員 只會 講錢 錢 錢 這樣是 對的,0,2016/5/21,13:42
194572318-16,194572318,16,臺北醫學大學,m,5月23日 13:22,b16 同學 畢業 就知道 學修 高層 其實 就是 moneytalks 研究 也是,0,2016/5/23,13:22
186452658-1,186452658,1,臺北醫學大學,m,5月5日 14:21,參加 麻煩 好嗎,7,2016/5/5,14:21
186452658-2,186452658,2,原PO - 臺北醫學大學 藥學系,m,5月5日 14:39,有點 麻煩 就像 大家 作業 也是 抄來抄去 啊 只是 問問 有沒有 願意 提供 不願意 不會 勉強,0,2016/5/5,14:39
186452658-3,186452658,3,臺北醫學大學,m,5月5日 17:41,大家 都是 抽獎 的給 答案 機會 不就 少了 付出 才有 收穫,2,2016/5/5,17:41
186085068-1,186085068,1,臺北醫學大學 藥學系藥學組,m,5月5日 13:03,6666666 意思 啊,4,2016/5/5,13:03
186085068-2,186085068,2,一個把回應刪除的同學,o,5月5日 15:42,已經 刪除 內容 就像 dcard 一樣 錯過 無法 相見,0,2016/5/5,15:42
186085068-3,186085068,3,臺北醫學大學,m,5月5日 16:16,據說 搬到 基隆路,0,2016/5/5,16:16
186085068-4,186085068,4,臺北醫學大學,f,5月5日 16:31,大概是 管院 辦公室 早就 搬到 基隆路 那邊 才會 想說 乾脆 都搬,0,2016/5/5,16:31
186085068-5,186085068,5,臺北醫學大學 醫務管理學系,m,5月5日 17:09,真的 發科,2,2016/5/5,17:09
186085068-6,186085068,6,臺北醫學大學,m,5月5日 23:46,真的 ㄛ 搬到 六張犁 基隆路 那裡 ㄛ 午餐 難吃 祥和 ㄛ 祥和 大使,3,2016/5/5,23:46
186085068-7,186085068,7,臺北醫學大學 醫務管理學系,f,5月6日 00:59,是的 超級 不爽,0,2016/5/6,00:59
186085068-8,186085068,8,臺北醫學大學 醫務管理學系,m,5月6日 08:48,這一點 也不 6r 上個 通 弒 課 還要 走,0,2016/5/6,08:48
186085068-9,186085068,9,臺北醫學大學 醫務管理學系,f,5月6日 15:10,基隆路 校區 qq,0,2016/5/6,15:10
186085068-10,186085068,10,臺北醫學大學,m,5月8日 03:12,逼 九 隻 眼睛 有看到 一群 醫管 正妹,3,2016/5/8,03:12
186085068-11,186085068,11,臺北醫學大學 醫務管理學系,m,5月8日 17:46,樓上 就算是 同系 憤怒 發言 我也 絕不 意外 魯智深,0,2016/5/8,17:46
186085068-12,186085068,12,臺北醫學大學 醫學科學研究所,m,5月10日 13:48,這樣 少了 醫管系 一大群 妹妹 嗚嗚 嗚,4,2016/5/10,13:48
186085068-13,186085068,13,臺北醫學大學 96醫學系,m,5月12日 15:16,掰 德威 超 羨慕 醫管 巨大 活動 空間,0,2016/5/12,15:16
186085068-14,186085068,14,臺北醫學大學,f,5月14日 04:43,可是 通識課 輔修 雙主修 學校 資源 利用 麻煩,5,2016/5/14,04:43
186085068-15,186085068,15,臺北醫學大學 醫務管理學系,m,5月14日 15:51,b16 還有 體育課,0,2016/5/14,15:51
186085068-16,186085068,16,臺北醫學大學 醫學資訊研究所,m,5月15日 05:26,93 級 老人 路過 能說 學校 高層 鬥爭 嚴重 學生 永遠是 犧牲品 學費 繳的 沒 比較 少 但是 權益 倒是 嗯 學弟妹們 加油,0,2016/5/15,05:26
183873860-1,183873860,1,臺北醫學大學,m,5月5日 15:41,得了 便宜 賣乖 覺得 有點 討厭,5,2016/5/5,15:41
183873860-2,183873860,2,臺北醫學大學 醫學系,f,5月5日 16:27,原野 社 發票 喔 其實,0,2016/5/5,16:27
183873860-3,183873860,3,臺北醫學大學,m,5月5日 17:39,店家 應該 主動 開發 票 我也 檢舉 過了 沒 現在 買 一塊 也要 開發 票多 一張 是個 機會 啊 誰 知道 會不會 中個 200 也好,3,2016/5/5,17:39
183873860-4,183873860,4,原PO - 臺北醫學大學,m,5月5日 17:51,b2 只要是 需要 開發 票 店家 必須要 主動 提供 發票 喔 統一發票 對獎 也是 鼓勵 消費者 監督 店家 誠實 納稅 啊 賺 更多 應該是 想想 怎樣 才能 吸引 更多 客源 而不是 謀取 這種 寡廉鮮恥 蠅頭小利 真夠 本事 學校 附近 影印店 也不會 這麼多,0,2016/5/5,17:51
183873860-5,183873860,5,一個把回應刪除的同學,o,5月8日 16:42,已經 刪除 內容 就像 dcard 一樣 錯過 無法 相見,0,2016/5/8,16:42
183873860-6,183873860,6,一個把回應刪除的同學,o,5月8日 16:44,已經 刪除 內容 就像 dcard 一樣 錯過 無法 相見,0,2016/5/8,16:44
183873860-7,183873860,7,一個把回應刪除的同學,o,5月8日 17:32,已經 刪除 內容 就像 dcard 一樣 錯過 無法 相見,0,2016/5/8,17:32
183873860-8,183873860,8,一個把回應刪除的同學,o,5月9日 04:32,已經 刪除 內容 就像 dcard 一樣 錯過 無法 相見,0,2016/5/9,04:32
183873860-9,183873860,9,臺北醫學大學 藥學系藥學組,m,5月9日 15:58,b1 是說 原 po 還是 店家 啊 樓上 怎麼 這麼多 刪 留言,1,2016/5/9,15:58
183873860-10,183873860,10,臺北醫學大學,m,5月10日 14:15,b9 原 pob1,0,2016/5/10,14:15
183873860-11,183873860,11,原PO - 臺北醫學大學,m,5月10日 17:27,得了 便宜 並沒有 得了 便宜 也不會 印 東西 這個 社會 本來 就是 這樣 我的 權利 受損 會去 爭取 不干 我的 事 就會 覺得 別人 這是 何必 拿到 臭的 共筆 花了 更多 錢 買 教科書 原因 都是 這些 店家 噱 覺得 你的 權益 受損 想來 評論 開放 接受 這本 就是 言論自由 po 這篇 文 用意 告訴 大家 社會 還有 許多 公義 事 食安 如此 交通 如此 職場 如此 政治 也是 如此 大家 不聽 不看 不說 就會 助長 這種 歪風 大可 默默 檢舉 在這裡 po 文 還可能 讓人 以為 只是 在這裡 取暖 無論 b1 也好 b10 也好 你會 這麼說 想必 覺得 根本 沒什麼 原 po 以後 賺 錢 也不 差 這些 店家 多 吸收 為什麼 還是要 這樣 請 仔細想 為什麼 覺得 沒什麼 北醫 不是 最愛 反思 嗎 只是 理性 討論 歡迎 理性 回覆,3,2016/5/10,17:27
183873860-12,183873860,12,臺北醫學大學,f,5月10日 18:59,推原 po 自己的 權益 爭取 看到 不公不義 勇敢 檢舉,3,2016/5/10,18:59
183873860-13,183873860,13,臺北醫學大學,m,5月11日 04:15,b1 不知道 在想,1,2016/5/11,04:15
183873860-14,183873860,14,臺北醫學大學,m,5月12日 17:16,推 b0b1 只是 引戰 而已 別理 不然 就是 原野 社 要帶 風向 b3,0,2016/5/12,17:16
183873860-15,183873860,15,臺北醫學大學 96醫學系,m,5月22日 05:52,以前 不是 都會 開發 票 嗎 現在是 換 工讀生 弄 是不是,1,2016/5/22,05:52
183873860-16,183873860,16,臺北醫學大學,m,5月22日 17:11,耶 現在 基本上 還是 兩位 阿姨 弄 似乎 真的 蠻 多人 不知道 能要 發票 這件事,1,2016/5/22,17:11
183873860-17,183873860,17,臺北醫學大學,m,5月22日 18:07,我是 b1 拜託 誰 吃飽 太閒 引戰 啊 只是說 出 我的 想法 原野 社 設在 校內 就是 方便 學生 不喜歡 別間 啊 而且 只要 要求 也是 發票 只是 覺得 幹嘛 一定要 刁難 就像 原 po 覺得 爭取 權益 只是 講出 自己的 看法,0,2016/5/22,18:07
183873860-18,183873860,18,臺北醫學大學 藥學系藥學組,m,5月22日 18:35,個人 覺得 b0 b1 堅持 的點 不同 b0 覺得 沒開 發票 逃漏稅 行為 b1 覺得 沒開 發票 感覺 繼續 提出 意見 好像 得不到 共識 不如 建議 原野 社設 告示 發票 先 告知 之類 這是 個人 覺得 兩邊 意見 都能 兼得 做法,0,2016/5/22,18:35
179220102-1,179220102,1,臺北醫學大學,f,5月3日 10:12,桃竹苗 美食 週,8,2016/5/3,10:12
179220102-2,179220102,2,臺北醫學大學,m,5月3日 12:46,去年 抽過 凶 qaq,0,2016/5/3,12:46
179220102-3,179220102,3,臺北醫學大學 藥學系藥學組,m,5月3日 16:00,嘿 那個 抽筋 我沒有 綽,6,2016/5/3,16:00
179220102-4,179220102,4,臺北醫學大學 藥學系藥學組,m,5月4日 06:34,樓上 今天 換抽到 大吉 應該 不會 抽筋 xddd,3,2016/5/4,06:34
179159154-1,179159154,1,臺北醫學大學,f,5月4日 13:00,推 心急如焚 原 po,0,2016/5/4,13:00
177761935-1,177761935,1,臺北醫學大學,m,5月3日 08:23,妳 創 一個,6,2016/5/3,08:23
177761935-2,177761935,2,臺北醫學大學,f,5月3日 15:34,發 囉 學生 活動 看板 好了吧,0,2016/5/3,15:34
177761935-3,177761935,3,臺北醫學大學 藥學系,f,5月4日 05:20,喔 秘密 社團 哈哈,0,2016/5/4,05:20
177761935-4,177761935,4,臺北醫學大學 醫學檢驗暨生物技術學系,m,5月4日 05:24,真的 推 免費 便當 都很 好吃 有時候 學生 看板 還要 學術 活動 網 或是 行事曆 裡面 找 圖書館 活動 還要 自己的 網頁 才能 報名 都沒有 統整 tat,1,2016/5/4,05:24
177761935-5,177761935,5,臺北醫學大學 藥學系,m,5月4日 12:59,加 貼個 社團 連結 嗎,0,2016/5/4,12:59
177761935-6,177761935,6,臺北醫學大學 牙醫學系,m,5月5日 12:35,也想 加 哈哈,0,2016/5/5,12:35
177761935-7,177761935,7,臺北醫學大學 醫學檢驗暨生物技術學系,m,5月6日 03:01,請 搜尋 北醫 吃 便當 新創 xd 整理 5 月 便當 講座,3,2016/5/6,03:01
177761935-8,177761935,8,臺北醫學大學 醫學系,m,5月6日 14:47,結果 釣出 一堆 系邊 校邊,1,2016/5/6,14:47
169110264-1,169110264,1,臺北醫學大學,f,4月29日 18:01,推 20 喜歡 更新 就算 是不 認識 xd,6,2016/4/29,18:01
169110264-2,169110264,2,臺北醫學大學,f,4月29日 18:15,富姦 形容詞 我想 很久 恍然大悟,4,2016/4/29,18:15
169110264-3,169110264,3,原PO - 臺北醫學大學 ,m,4月29日 18:20,b1 好的 告白 北醫 上次 更新 420 再給 一個 禮拜 好了 b2 宅度 差距,3,2016/4/29,18:20
169110264-4,169110264,4,臺北醫學大學 醫學檢驗暨生物技術學系,f,4月30日 06:04,喜歡 告白 北醫 總 覺得 一個人 用心 寫下 一個人 感覺 推 20 快出來,2,2016/4/30,06:04
169110264-5,169110264,5,臺北醫學大學,f,4月30日 09:41,富姦,0,2016/4/30,09:41
169110264-6,169110264,6,原PO - 臺北醫學大學 ,m,4月30日 11:23,httppttpediapixnetnetblogpost45069242 富奸富 奸化,1,2016/4/30,11:23
169110264-7,169110264,7,臺北醫學大學,f,4月30日 12:28,當然是 告白 好朋友 然後 tag,2,2016/4/30,12:28
169110264-8,169110264,8,原PO - 臺北醫學大學 ,m,4月30日 14:55,b1b2b4b5b6httpswwwfacebookcom 告白 北醫 20508129046026212 感謝 大家 支持 專頁 已經 創 好了 麻煩 大家 多 按 讚 多 告白 多 推廣 希望 大家 都可以 藉由 這個 專頁 說出 心裡話,5,2016/4/30,14:55
168135632-1,168135632,1,臺北醫學大學 醫務管理學系,m,4月29日 08:55,第一天 上學 嗎,3,2016/4/29,08:55
168135632-2,168135632,2,臺北醫學大學 藥學系藥學組,m,4月30日 03:42,以為 到了 黑特版,1,2016/4/30,03:42
168135632-3,168135632,3,臺北醫學大學,f,4月30日 16:07,還有 daedline 要求 配合,0,2016/4/30,16:07
168135632-4,168135632,4,臺北醫學大學,m,5月1日 14:47,推 北醫 文化,0,2016/5/1,14:47
168135632-5,168135632,5,臺北醫學大學,m,5月3日 07:56,拖延 很多 通病 直到 出糗 才會 做事 不過 試著 提早 他說 看看 好像 太 佛心,1,2016/5/3,07:56
141551939-1,141551939,1,臺北醫學大學 醫學檢驗暨生物技術學系,m,4月21日 06:37,當然有 囉 副校長 兒子 啊,37,2016/4/21,06:37
141551939-2,141551939,2,一個把回應刪除的同學,o,4月21日 07:18,已經 刪除 內容 就像 dcard 一樣 錯過 無法 相見,0,2016/4/21,07:18
141551939-3,141551939,3,臺北醫學大學,f,4月21日 07:38,只有 不知道 副校長 不知道 他的 兒子 是誰 嗎,10,2016/4/21,07:38
141551939-4,141551939,4,臺北醫學大學 藥學系藥學組,m,4月21日 08:18,b31,3,2016/4/21,08:18
141551939-5,141551939,5,臺北醫學大學,m,4月21日 10:53,邱 xx,0,2016/4/21,10:53
141551939-6,141551939,6,臺北醫學大學,f,4月21日 12:38,大幾 啊,0,2016/4/21,12:38
141551939-7,141551939,7,臺北醫學大學,m,4月21日 12:47,b6 已經 大四 囉 應該 過的 蠻 愜意,2,2016/4/21,12:47
141551939-8,141551939,8,臺北醫學大學,m,4月21日 17:15,邱副 兒子 醫技轉 醫學 女兒 保健 轉 牙醫,12,2016/4/21,17:15
141551939-9,141551939,9,臺北醫學大學,m,4月21日 17:40,無聊 副校長 事 炒冷飯 炒到 不想 知道,9,2016/4/21,17:40
141551939-10,141551939,10,臺北醫學大學,m,4月22日 01:19,覺得 應該 不只 學校 不信 學校 後門 走,1,2016/4/22,01:19
141551939-11,141551939,11,臺北醫學大學 醫學檢驗暨生物技術學系,m,4月22日 03:53,副校長 兒子 是轉 成功 沒錯 很有 實力 啊 不是 進去 爛爛,21,2016/4/22,03:53
141551939-12,141551939,12,一個把回應刪除的同學,o,4月22日 09:29,已經 刪除 內容 就像 dcard 一樣 錯過 無法 相見,0,2016/4/22,09:29
141551939-13,141551939,13,臺北醫學大學,m,4月23日 01:48,根本就是 硬要 扣 人家 帽子 阿 人家 就算是 實力 轉進 去的 人家 老爸 是誰 就要 硬 扣帽子 喔 人生 已經 夠 失敗 還要 在這裡 秀 下限 ㄎ ㄎ,13,2016/4/23,01:48
141551939-14,141551939,14,臺北醫學大學,f,4月23日 03:53,只有 我看 標題 以為在 幾個 校門 口 嗎,45,2016/4/23,03:53
141551939-15,141551939,15,臺北醫學大學,m,4月24日 12:29,原來 北醫 副校長 兒子 叫 名字,1,2016/4/24,12:29
141551939-16,141551939,16,臺北醫學大學,m,4月24日 12:34,實力 進後但 擺爛 vs 通過 關係 進 後來 努力 大家 怎看,8,2016/4/24,12:34
141551939-17,141551939,17,臺北醫學大學,f,4月24日 14:50,b16v21,1,2016/4/24,14:50
141551939-18,141551939,18,臺北醫學大學,f,4月27日 08:36,人家 大一 認真 讀書 成功 轉進 醫學系 之後 認真 就因為 他爸 副校長 就要 這樣 中傷,8,2016/4/27,08:36
141551939-19,141551939,19,臺北醫學大學,f,4月27日 17:18,b16 覺得 默默 中槍,0,2016/4/27,17:18
141551939-20,141551939,20,臺北醫學大學,f,4月29日 18:18,b1 標準 魯蛇 想轉 卻轉 不過 醫技有 這種 腦包 在這裡 秀 下限 也是 夠 丟臉 回去 怪 爸媽 沒給 一個 背景,2,2016/4/29,18:18
141551939-21,141551939,21,臺北醫學大學 醫學系,f,5月1日 09:55,他們的 實力 沒 有關係 還有 許多人 實力 認真 想進 進不了 有關係,2,2016/5/1,09:55
141551939-22,141551939,22,臺北醫學大學,m,5月1日 10:07,哎 與其 吵 這個 不如 關心 波波 落日 條款 現在 都還 旭日 高升 嘆,0,2016/5/1,10:07
141551939-23,141551939,23,臺北醫學大學,m,5月3日 01:30,北醫 真的 沒甚麼 後門 管道 副校長 兒子 也是 自己的 實力 考過 筆試 當然 面試 有利 真的 只是 不能 忽視 考過 筆試 擁有 努力 付出 北醫 入學 管道 幾乎 通過 正當 成績 篩選 面試 當然 保證 不會 受到 這種 事情 影響 進去 面試 都是 眾人 靠自己 脫穎而出 足夠的 能力 想靠 關係 錢 進 來的 像是 中部 醫學 大學 轉 醫學系 可是 連 價碼 有的 嘆,6,2016/5/3,01:30
141551939-24,141551939,24,臺北醫學大學,m,5月7日 00:49,興趣 其實 調查 一下 其實 查不到 xd 轉過去 除了 副校長 子女 還有 多少 像是 醫師 牙醫公會 會長 子女 還是 學校 醫生 牙醫 教授 子女 等等 猜 結果 應該 滿 有趣的 既然 老爸 副校長 又在 老爸 轄區 轉 不就 注定 扣帽子 嗎 啊 真 想要 避嫌 我有 實力 不靠 老爸 面子 怎麼 不去 林口 臺 中高 雄 偏偏 都來 北醫 北醫 不就 好棒,3,2016/5/7,00:49
141551939-25,141551939,25,臺北醫學大學 醫學系,m,5月7日 01:07,b24 除了 副校長 兒子 其他 證據 嗎 還是 都是 猜 而已 這樣 亂 造謠 不用 負責任 嗎,0,2016/5/7,01:07
141551939-26,141551939,26,臺北醫學大學,m,5月7日 01:23,感謝 25f 指正 ps 還有 一個 女兒 哦 本身 煽動 造謠 意思 真的是 蠻 好奇 真的 統計 出來 結果 一方 臉 既然 亮 學系 要不要 幫 轉系 世界 芸芸眾生 調查 一下 大家 感謝 你的 xd 另外 補充 其實 面試 含 術科 考試 給的 想像 空間 很大 而且 主觀 比重 越高 可能 越 多 今天 轉系 都是 憑 100 筆試 這種 硬實 力來 決勝負 我相信 傳言 不會 那麼 興盛 當然 有心人士 還是 傳出 什麼的,1,2016/5/7,01:23
141551939-27,141551939,27,臺北醫學大學 醫學系,m,5月7日 03:25,那就 有勞 調查 囉 只是 覺得 先有 證據 說話 應該是 做人 基本 道理 xd 不僅是 別人 尊重 也是 你自己 尊重,0,2016/5/7,03:25
141551939-28,141551939,28,臺北醫學大學,f,5月12日 07:19,一直 糾結 這種事 感覺 好魯 哦 你的 人生 就是 如此 悲哀 溫拿是 不會 理會 魯蛇 背後 ggyy 什麼的,1,2016/5/12,07:19
131776231-1,131776231,1,臺北醫學大學,f,4月18日 10:52,推 心理測驗,3,2016/4/18,10:52
131776231-2,131776231,2,臺北醫學大學 醫務管理學系,m,4月18日 11:45,陣子 專門 借 藥學 共筆 笑話,22,2016/4/18,11:45
131776231-3,131776231,3,臺北醫學大學 藥學系,m,4月18日 12:00,黃色笑話,3,2016/4/18,12:00
131776231-4,131776231,4,臺北醫學大學 藥學系,m,4月18日 12:05,一個 偏遠 山中 有個 古老的 村落 由於 世世代代 外界 隔絕 宛如 桃源 中人 外界 產生 濃厚 興趣 於是 一個 漂亮的 女 記者 前往 這個 落後 山鄉 採訪 當地人 採訪 對象 一個 五 十多歲 老者 知道 世世代代 與世隔絕 生活 以後 女 記者 大為 驚訝 繼而 好奇 於是 打算 描寫 一下 與世隔絕 生活 喜怒哀樂 請問 這麼多 年來 高興 一件 事情 好奇 女 記者 問有 一年 冬天 隔壁 老 三家 羊 山裡 走 丟了 老頭 羊 走了 值得 高興 嗎 女 記者 好奇 羊 走了 以後 幾十個 火把 上山 找 找了 三天三夜 終於 後山 一個 角落裡 面 找到 老者 吸了 口 菸 瞇 眼睛 回味無窮 找到 怎麼了 女 記者 好奇 的問 找到 時候 天 已經 很晚 雪堆 裡面 搭 帳篷 休息 外面 風 很大 感到 無聊 於是 大家 輪流 上了 那隻 羊 好爽 女 記者 顯然 感到 有點 尷尬 她想 避開 這個 話題 於是 打斷 老者 的話 問有 其它 高興 的事情 一年 冬天 前邊 老馬 家 新 媳婦 山裡 走 丟了 老者 後來 找到 嗎 女 記者 追問 幾十個 找了 三天三夜 終於 後山 角落裡 面 找到 於是 搭起 帳篷 休息 冬天 晚上 風 很大 大家 都很 無聊 於是 輪流 上了 老馬 他家 新 媳婦 提有 多爽 老者 敲 敲 手中 旱 菸 袋 女 記者 感到 尷尬 決定 避開 這個 話題 於是 問到 幾十年 與世隔絕 生活 究竟 值得 悲傷 的事情 那位 老者 突然 臉色 大變 手 開始 顫抖 幾乎 抓不住 手中 旱 菸 深陷 眼眶 滾出 兩滴 渾濁 淚水 嘴唇 哆嗦 好幾 他的 身體 似乎 顫抖 沉默 良久 他說 一年 冬天 我在 山裡 走 丟了,29,2016/4/18,12:05
131776231-5,131776231,5,臺北醫學大學,m,4月18日 12:48,放 一些 背誦 口訣 唉 或是 輕鬆的 圖,1,2016/4/18,12:48
131776231-6,131776231,6,臺北醫學大學 醫學系,m,4月18日 17:19,放本 寶寶 照片,4,2016/4/18,17:19
131776231-7,131776231,7,臺北醫學大學,f,4月19日 08:30,推 笑話,0,2016/4/19,08:30
