oID,PID,CIDX,Poster,Gender,CDate,Cmt,CLike,Date,Time
545142-11,545142,11,臺北醫學大學 牙醫學系,m,2015年9月13日 13:09,實習 老人 路過 該 玩的 時候 好好 玩吧 玩過 書 也要 記得 念 喔,3,2015/9/13,13:09
545142-12,545142,12,臺北醫學大學 藥學系,f,2015年9月14日 15:46,吉他社 不錯 加 學弟,4,2015/9/14,15:46
545142-13,545142,13,臺北醫學大學 呼吸治療學系,f,2015年9月14日 16:11,快來 吉他,1,2015/9/14,16:11
545142-14,545142,14,臺北醫學大學 牙醫學系,m,2015年9月14日 20:25,我是 楓杏 也許 外人 覺得 邪教 瘋子 我自己 覺得 學到 很多 只是 常常 承受 異樣 眼光 哈哈 我不 討厭 楓杏 制度 也不 全部 喜歡 在這裡 交到 很多 好朋友 這是 留下來 不退 團 的原因 楓杏 很累 辛苦 我認為 值得 以上 個人 淺見 給 學弟 參考,13,2015/9/14,20:25
545142-15,545142,15,臺北醫學大學 牙醫學系,m,2015年9月15日 16:36,哈哈哈 樓上 我覺得 邪教 瘋子 沒什麼 不好 啊 就是 像 邪教 像 瘋子 一樣 做事 才夠 轟轟烈烈 夠 深刻 不只是 楓杏 任何 社團 都是 一群 瘋子 們 撐起來 每個 社團 本來 有好有壞 樹大 自然會 招風 正常 只是 團體 願不願意 承認 並且 虛心 改進 這屆系 只有 我是 楓杏 可是 吸引 待到 從楓 杏 畢業 一定有 特別的 地方 每個人 感受 不同 也不 一定 每個人 加入 楓杏 都能 像 學長 姐 講的 體會 這麼多 自己的 大學 生活 負責 選擇 有緣人 自然會 找到 屬於 自己的 一片 天祝 有個 精彩的 大學生 活記 唸書 喔,13,2015/9/15,16:36
545142-16,545142,16,臺北醫學大學,m,2015年9月15日 16:46,樓上 該 不會是 專業 加 朝聖,2,2015/9/15,16:46
545142-17,545142,17,臺北醫學大學,m,2015年9月15日 17:31,啡,2,2015/9/15,17:31
545142-18,545142,18,臺北醫學大學,m,2015年9月16日 06:46,楓 狂杏艾射 推,2,2015/9/16,06:46
545142-19,545142,19,臺北醫學大學,f,2015年9月17日 17:24,b1 不夠 了解 不要在 那邊 該 只會 顯得 妳 超 無知 有些 東西 進去 知道 每個 社團 有好有壞 不是 聽 片段 決定 一切 b18 呵呵 腦子 裝 什麼的 說什麼 樣 的話,1,2015/9/17,17:24
545142-20,545142,20,臺北醫學大學 藥學系藥學組,m,2015年9月17日 19:44,b8 怎麼說 當天 音控 楓杏 出品 一樣 如果是 那幫 其他 社團 音控 也是 蠻 善良 不是 只不過是 第一個 放 音樂 社團 大哥 沒 控制 罷了,0,2015/9/17,19:44
545142-21,545142,21,臺北醫學大學,m,2015年9月17日 23:27,b19 呵呵 無腦 粉要 出來 說話 嗎 去年 一開始 還不是 很多 都想 後來 幾乎 退 光了 為什麼 就是 爛 啊,0,2015/9/17,23:27
545142-22,545142,22,臺北醫學大學 醫學檢驗暨生物技術學系,m,2015年9月18日 03:06,打系 排好 啊 新生盃 見 醫技 新生盃 冠軍,3,2015/9/18,03:06
545142-23,545142,23,臺北醫學大學 藥學系,m,2015年9月22日 02:52,b19 根本 嗆 嗆 頗 ㄏ 很多 社團 一開始 還不 一堆 人想 加想 嘗試 後來 知道 不適合 漸漸 淡出 最好 每個 社團 都爛 ㄏ ㄏ,1,2015/9/22,02:52
545142-24,545142,24,臺北醫學大學 牙醫學系,m,2015年9月22日 13:31,口療隊 海外 醫療 服務 隊 系學會 牙醫 營系隊 都會 歡迎 der 比賽 還有 合唱 也是 融入 班上 方法,1,2015/9/22,13:31
545142-25,545142,25,臺北醫學大學,m,2015年9月22日 14:16,吉他社 歡迎,1,2015/9/22,14:16
545142-26,545142,26,臺北醫學大學 醫學檢驗暨生物技術學系,m,2015年9月22日 16:27,哎呀 明天 1210 新生盃 c 場 要和 牙醫 系 pk 彼此 加油 囉,1,2015/9/22,16:27
544856-1,544856,1,臺北醫學大學,f,2015年9月10日 10:20,北醫 通常 每個人 外務 很多 有的 忙 打工 有的 忙 社團 有的 忙 以前 高中 同學 有的 瞎忙 建議 室友 開始 認識 朋友 哈哈哈 可能 大家 不熟 才會 低頭 滑滑 滑學妹 加油,7,2015/9/10,10:20
544856-2,544856,2,臺北醫學大學,f,2015年9月10日 11:17,可能是 剛進 大學 不熟 開學 後有 一些 活動 上課 小組 互動 應該會 變好 或者 妳 也可以 主動 認識 其他人 加油,3,2015/9/10,11:17
544856-3,544856,3,臺北醫學大學 醫學系,m,2015年9月10日 11:31,我想 報名 當 導遊 三年 前 我也 孤身 來台 北 奮鬥 心裡 總 企盼 有人 帶領 如今 地方 學妹 弟有 困難 當仁不讓 日子 訂在 涼爽 午後 拇山 宿舍 門口 不見不散 xd,19,2015/9/10,11:31
544856-4,544856,4,臺北醫學大學,m,2015年9月10日 13:51,完全 相同的 感受,1,2015/9/10,13:51
544856-5,544856,5,臺北醫學大學,m,2015年9月10日 14:18,該 吃 中飯 囉,0,2015/9/10,14:18
544856-6,544856,6,原PO - 臺北醫學大學 ,f,2015年9月10日 16:42,b1b2 希望 如此 b3 想問 學長 幾年級 我想 認識 校園 帶路 b4 系 同病相憐,1,2015/9/10,16:42
544856-7,544856,7,臺北醫學大學,m,2015年9月10日 16:45,哈哈 我升 四年級 一直在 想在 這要 怎麼 給你 聯絡 資訊 xd 真 苦惱,0,2015/9/10,16:45
544856-8,544856,8,原PO - 臺北醫學大學 ,f,2015年9月10日 16:48,b7 學長 系 約 時間 地點 特徵 哈哈,1,2015/9/10,16:48
544856-9,544856,9,臺北醫學大學,m,2015年9月10日 16:55,我是 b7 b3 哈哈 認真的 認真 嗎 xd,0,2015/9/10,16:55
544856-10,544856,10,原PO - 臺北醫學大學 ,f,2015年9月10日 17:00,b7 學長 我知道 當然是 認真的 現在 處於 學校 迷路 狀態 還沒 說什麼 系 耶,1,2015/9/10,17:00
544856-11,544856,11,臺北醫學大學 醫學系,m,2015年9月10日 17:18,哈哈 醫學系 913 才會 回 學校 第一天 上課 應該在 教學 大樓 紅紅 那棟 可能 也要 認識 一下 學校 網站 xd 學學 長姊 應該 都會 你說 大學 第一天 還不 太 知道 標記 齁 httpwwwtmuedutwaboutsuperpagesphpidabout2,3,2015/9/10,17:18
544856-12,544856,12,臺北醫學大學,m,2015年9月10日 17:24,需要 介紹 也可以 找 舉手 不過 建議 學妹 還是 自己的 系 公布 一下 妳 同系 學長 姐 比較好 接 這樣的 case 畢竟 外系 帶 妳 逛 怪怪的 而且 系裡 資訊 不見得 提供給 妳,1,2015/9/10,17:24
544856-13,544856,13,原PO - 臺北醫學大學 ,f,2015年9月10日 21:44,b11b12 喔 謝謝 不過 怎麼 系 顯示 學校 後面 呀,0,2015/9/10,21:44
544856-14,544856,14,臺北醫學大學 藥學系,m,2015年9月11日 01:14,應該是 妳 po 文 時候 選 匿名 然後 原 po 不能 改成 匿名 就不會 顯示 直接 留言 寫出來 只寫 系 的話 我想 dcard 通融,0,2015/9/11,01:14
544856-15,544856,15,原PO - 臺北醫學大學 ,f,2015年9月11日 01:36,b14 我沒有 按 匿名 耶 我是 護理系 喔,1,2015/9/11,01:36
544856-16,544856,16,臺北醫學大學 藥學系,m,2015年9月11日 01:57,po 文 時候 不小心 按 到了 妳 po 看看 妳 方便的 時間 應該 有人 帶 妳,1,2015/9/11,01:57
544856-17,544856,17,臺北醫學大學 護理學系,m,2015年9月11日 08:45,護理系 新生 1 我也 覺得 好悶 啊啊啊,2,2015/9/11,08:45
544856-18,544856,18,臺北醫學大學,m,2015年9月11日 09:01,別急 開學 很精采 學長 姊們 大家 準備 一連串 迎新 活動 多來 參加 晚上 省 荷包 中午 新生盃 球賽 一較高下 老師 第 一堂課 三句 下課 揪 ubike 自由 行,1,2015/9/11,09:01
544856-19,544856,19,臺北醫學大學 護理學系,m,2015年9月11日 13:27,喔喔 護理系 耶 可惜 畢業 xdd 不過 最近 還在 學校 打混 就是了,1,2015/9/11,13:27
544856-20,544856,20,臺北醫學大學,m,2015年9月11日 14:43,b19 哈囉 搖滾,1,2015/9/11,14:43
544856-21,544856,21,臺北醫學大學 護理學系,f,2015年9月11日 15:49,913 星期日 九點 護理 迎新 茶會 學弟妹 大家 一起來 交朋友 學長 姐等 歐啾 咪,1,2015/9/11,15:49
544856-22,544856,22,臺北醫學大學,m,2015年9月11日 16:49,我也是 護理 新生 真的 同病相憐 哈哈哈 約 一下 阿,1,2015/9/11,16:49
544856-23,544856,23,臺北醫學大學 護理學系,m,2015年9月11日 17:38,b22 嗨 同學 你好 認識 一下 嗎 哈哈 我是 b17,0,2015/9/11,17:38
544856-24,544856,24,臺北醫學大學 護理學系,m,2015年9月11日 19:47,b20 這樣 認得 出來 是誰 我是 b19,1,2015/9/11,19:47
544856-25,544856,25,臺北醫學大學,m,2015年9月12日 02:05,b24 你的 字裡行間 也是 我的 信仰,1,2015/9/12,02:05
544856-26,544856,26,臺北醫學大學,m,2015年9月12日 03:43,b17 安安 但是 怎麼 認識,0,2015/9/12,03:43
544856-27,544856,27,臺北醫學大學 護理學系,m,2015年9月12日 04:14,b22 有加 系群 嗎,1,2015/9/12,04:14
544856-28,544856,28,臺北醫學大學 護理學系,m,2015年9月12日 05:33,b17 有的,1,2015/9/12,05:33
544856-29,544856,29,臺北醫學大學 護理學系,m,2015年9月12日 06:52,b22 你要 透露 一下 資訊 嗎 直接 line 哈哈,1,2015/9/12,06:52
544856-30,544856,30,臺北醫學大學,m,2015年9月12日 11:26,推 b29 學長,1,2015/9/12,11:26
514907-1,514907,1,臺北醫學大學 藥學系,f,2015年9月1日 13:26,通識課 年級 不用 理他 不管 上面 寫 大一 大二 都可以 選 如果是 別系 必修 找 那門課 主授 老師 加簽 選修 的話 好像 選課 系統 點,9,2015/9/1,13:26
514907-2,514907,2,原PO - 臺北醫學大學 ,m,2015年9月1日 13:29,b1 了解 謝謝 學姐,1,2015/9/1,13:29
514907-3,514907,3,臺北醫學大學 護理學系,f,2015年9月3日 00:42,爬 爬 通識 版 這些 大家 問過,4,2015/9/3,00:42
514907-4,514907,4,原PO - 臺北醫學大學 ,m,2015年9月3日 06:06,b3 通識 版 嗎 都沒 看到 欸,0,2015/9/3,06:06
514907-5,514907,5,臺北醫學大學 護理學系,f,2015年9月3日 08:11,臉書 喔,2,2015/9/3,08:11
514907-6,514907,6,原PO - 臺北醫學大學 ,m,2015年9月3日 13:09,b5 喔 謝謝,0,2015/9/3,13:09
514907-7,514907,7,臺北醫學大學,f,2015年9月6日 15:33,好想 騙 學弟妹 不能 選 喔 xdd,8,2015/9/6,15:33
514907-8,514907,8,原PO - 臺北醫學大學 ,m,2015年9月6日 16:12,b7 來不及 學姐 哈哈,0,2015/9/6,16:12
514907-9,514907,9,臺北醫學大學,f,2015年9月9日 16:24,選課 根本 賭博 超煩,6,2015/9/9,16:24
514471-1,514471,1,臺北醫學大學,m,2015年9月1日 12:01,因為有 特權 內部 似乎 鬥爭 我覺得 不好 我是 這樣 覺得,7,2015/9/1,12:01
514471-2,514471,2,臺北醫學大學,f,2015年9月1日 12:08,推基服 溫暖 好社 哈哈 學長 姐人 超好 寒出 育樂 營 還可以 帶 可愛的 小孩,13,2015/9/1,12:08
514471-3,514471,3,臺北醫學大學,m,2015年9月1日 12:25,推 參加 社團 北醫 社團 優秀,1,2015/9/1,12:25
514471-4,514471,4,臺北醫學大學,m,2015年9月1日 12:27,不怕苦 不怕累 微笑 面對 一天,13,2015/9/1,12:27
514471-5,514471,5,原PO - 臺北醫學大學 ,f,2015年9月1日 12:32,b1 特權 指 內部 鬥爭 噢 覺得 可怕 b4 那是,0,2015/9/1,12:32
514471-6,514471,6,臺北醫學大學,m,2015年9月1日 12:40,b5 特權 基本 款 的話 妳 先 他們的 社辦 其他人 社辦 比較 或是 看看 他們的 置物櫃 註 北醫 不是 每個 系 都有 置物櫃 不要 社團 其實 蠻 明顯的 喔 也可以 這裡 爬文 httpswwwfacebookcomhatetmu2frefts,10,2015/9/1,12:40
514471-7,514471,7,臺北醫學大學 藥學系藥學組,m,2015年9月1日 13:43,校慶 時候 鬥 得很 激烈,0,2015/9/1,13:43
514471-8,514471,8,原PO - 臺北醫學大學 ,f,2015年9月1日 14:07,b2 噢 我會 考慮 謝謝妳 b7 意思,0,2015/9/1,14:07
514471-9,514471,9,臺北醫學大學 藥學系藥學組,m,2015年9月1日 14:34,黑特版 就知道 為他們 特權 坐在 中間 有人 不爽 黑特 有人 護航 就是 這樣 激烈 還有 其實是 b1xdd,0,2015/9/1,14:34
514471-10,514471,10,臺北醫學大學,m,2015年9月1日 15:27,校慶 那時 坐 中間的 升 大一 學弟妹 耶 那麼 可愛 坐 中間 關係 xd,4,2015/9/1,15:27
514471-11,514471,11,臺北醫學大學,m,2015年9月1日 15:27,校慶 那時 坐 中間的 升 大一 學弟妹 耶 那麼 可愛 坐 中間 關係 xd,5,2015/9/1,15:27
514471-12,514471,12,臺北醫學大學 藥學系藥學組,m,2015年9月2日 06:24,學弟妹 喔 抱歉 看不出來 xddd,1,2015/9/2,06:24
514471-13,514471,13,臺北醫學大學 醫學系,m,2015年9月2日 11:17,我到 覺得 校慶 那時 可憐 耶 xd 完全 來充 場面 當時 應該會 冏 哈哈,5,2015/9/2,11:17
514471-14,514471,14,原PO - 臺北醫學大學 ,f,2015年9月2日 12:43,聽 學說 那是 體驗 營的 所以是 被叫 撐場面,0,2015/9/2,12:43
514471-15,514471,15,一個把回應刪除的同學,o,2015年9月2日 12:54,已經 刪除 內容 就像 dcard 一樣 錯過 無法 相見,0,2015/9/2,12:54
514471-16,514471,16,臺北醫學大學,m,2015年9月2日 13:01,推杏青 康輔 基服 也是 友社 xddd 藍衣人 熱情奔放 寒暑假 出 服務 隊 收穫 滿滿 哦,7,2015/9/2,13:01
514471-17,514471,17,臺北醫學大學 護理學系,f,2015年9月3日 00:41,推水服,1,2015/9/3,00:41
514471-18,514471,18,原PO - 臺北醫學大學 ,f,2015年9月3日 00:51,b16 噢 謝謝你 b17 那要 游泳 嗎 我不會 游泳,0,2015/9/3,00:51
514471-19,514471,19,臺北醫學大學,m,2015年9月3日 06:33,推基服 康輔山 服楓 杏 友社 而且 更以 傳統文化 表演 聞名世界,3,2015/9/3,06:33
514471-20,514471,20,臺北醫學大學,m,2015年9月3日 06:38,推社研 社團 精英 在此,6,2015/9/3,06:38
514471-21,514471,21,臺北醫學大學,m,2015年9月3日 10:22,原來 社團 跟楓 杏 友社,7,2015/9/3,10:22
514471-22,514471,22,臺北醫學大學,m,2015年9月3日 14:00,還有 楓林 杏服團,1,2015/9/3,14:00
514471-23,514471,23,臺北醫學大學,m,2015年9月4日 02:49,b4 明明 就是 不怕死 不怕累 微笑 面對 一天 xd 那裡 哪一天 有人 爆肝 累死 都不 意外 而且 光社 辦 三個 還有 無數 倉庫 你說 不是 特權 特權 b19 竟然 為他們 友社 xd 原本是 康山基 三國鼎立 自從 楓杏竄 反而 促成 三社 合作 力 抗楓 杏 捏 待過 看清 一切的,7,2015/9/4,02:49
514471-24,514471,24,臺北醫學大學,m,2015年9月4日 03:33,楓杏有 值得 學習 地方 不然 現在 怎麼 變得 這麼 強盛 當然 不能 推給 特權 楓杏 人在 班上 並不會 非常 令人 討厭 但楓 杏 這個 社團 有時 滿 令人 討厭的 康輔 路過,21,2015/9/4,03:33
514471-25,514471,25,臺北醫學大學,m,2015年9月4日 10:00,綠色 奇蹟 耶 溫馨 誠懇 負責 米 尚青楓 杏 醫青 鹽水蜂炮 安全帽 崩 蹦蹦 蹦蹦 舞會 超 好玩,2,2015/9/4,10:00
514471-26,514471,26,臺北醫學大學 牙體技術學系,m,2015年9月4日 17:20,山服 山服,6,2015/9/4,17:20
514471-27,514471,27,臺北醫學大學 醫務管理學系,f,2015年9月6日 18:44,推韓研 歡樂 學到 各種 東 西從 韓文 mv 舞蹈 韓式 料理 美妝 時尚 旅遊 飲食 飲酒 文化 等等 全部 都會 教 喔 歡迎 917 迎新 茶會 玩 xdd,5,2015/9/6,18:44
514471-28,514471,28,臺北醫學大學,f,2015年9月7日 15:39,待過 楓杏 特權 是有 也是 付出 很多 東西 換來 不是 表面上 看到 那麼 美好 至於 鬥爭 抱歉 我還 真的 沒 看到 欸 不懂 何來 鬥爭 一詞 體驗 營 那次 學校 逼 去的 否則 誰 他媽 想在 裏 呵呵 那麼久 排的 活動 都比 精采 咩 完全 就是 學校 逼 充 場面 楓杏 的確是 學到 滿多 東西 從中 累積 很多 經驗 每個 社團 有好有壞 你自己 如何 定奪,11,2015/9/7,15:39
514471-29,514471,29,臺北醫學大學,f,2015年9月7日 17:35,唉 楓杏 真的 非常 特權 啊,3,2015/9/7,17:35
514471-30,514471,30,臺北醫學大學,m,2015年9月10日 07:13,妹窟,1,2015/9/10,07:13
509453-1,509453,1,臺北醫學大學,m,2015年8月31日 09:57,參加 體驗 營了 嗎 社團 學長 姐 都是 楷模,7,2015/8/31,09:57
509453-2,509453,2,臺北醫學大學,m,2015年8月31日 12:23,楓 x 學長 姐會 指引 你的 人生 方向 啊 當然 不是 系上,20,2015/8/31,12:23
509453-3,509453,3,臺北醫學大學,m,2015年8月31日 12:40,樓上 反串 新生 看不懂 不要 誤入歧途,18,2015/8/31,12:40
509453-4,509453,4,臺北醫學大學 護理學系,f,2015年8月31日 12:59,同是 南部 人我 高雄 xd,2,2015/8/31,12:59
509453-5,509453,5,臺北醫學大學,m,2015年8月31日 13:02,遠離 綠海 諸多 樂果 保護 眼睛 家庭 安樂 身體健康 幸福 美滿 科科 擠霸,9,2015/8/31,13:02
509453-6,509453,6,臺北醫學大學 醫學系,m,2015年8月31日 13:17,推 通化 夜市 閃光 故事 開始 鳳梨蝦球 甜 彼此 心頭,7,2015/8/31,13:17
509453-7,509453,7,臺北醫學大學,m,2015年8月31日 13:19,b3 不能 亂說話 嚇跑 學弟妹 一個 社團 好不好 親身 體驗 過再 評論,5,2015/8/31,13:19
509453-8,509453,8,臺北醫學大學,f,2015年8月31日 14:22,小吃街 慢慢 吃 啊 吃 第五年 走 五遍 還不 知道 吃,5,2015/8/31,14:22
509453-9,509453,9,臺北醫學大學,m,2015年8月31日 14:35,吃 廣東粥 魚湯 阿宗 魯肉飯 湯圓 我是 在在 閃光 告白 想來 小吃街 充滿 美好 回憶,4,2015/8/31,14:35
509453-10,509453,10,原PO - 臺北醫學大學 ,f,2015年8月31日 15:38,楓杏 到底是 阿 哈哈哈 xd,2,2015/8/31,15:38
509453-11,509453,11,原PO - 臺北醫學大學 ,f,2015年8月31日 15:39,b6 閃閃 der,1,2015/8/31,15:39
509453-12,509453,12,原PO - 臺北醫學大學 ,f,2015年8月31日 15:40,b4 嗨 囉,0,2015/8/31,15:40
509453-13,509453,13,原PO - 臺北醫學大學 ,f,2015年8月31日 15:40,b1 請問 學長 體驗 營 忘記 我是 轉學生 qq,2,2015/8/31,15:40
509453-14,509453,14,原PO - 臺北醫學大學 ,f,2015年8月31日 15:41,b3 求解,1,2015/8/31,15:41
509453-15,509453,15,臺北醫學大學,f,2015年8月31日 16:16,楓杏 是個 社團 不用 一定要 加 好好 感受 別人 加 之後的 心得 ˊ ˇ ˋ,9,2015/8/31,16:16
509453-16,509453,16,臺北醫學大學 護理學系,m,2015年8月31日 16:18,一開始 推坑楓 x 不太好 xd 之前 都是 騎車 貓空 泡茶 玩 桌遊,1,2015/8/31,16:18
509453-17,509453,17,臺北醫學大學 牙體技術學系,m,2015年8月31日 16:52,喔喔 喔 私醫 聯招 我也是 人生地不熟 嗚嗚,2,2015/8/31,16:52
509453-18,509453,18,臺北醫學大學,m,2015年8月31日 16:53,拒絕 楓杏,6,2015/8/31,16:53
509453-19,509453,19,臺北醫學大學,m,2015年8月31日 17:11,推 b15,4,2015/8/31,17:11
509453-20,509453,20,臺北醫學大學,m,2015年8月31日 17:30,看看 楓杏大 朋友 系上 社團 裡的 人緣 好壞 差異 就知道,5,2015/8/31,17:30
509453-21,509453,21,臺北醫學大學,f,2015年8月31日 19:32,雞 太郎 好吃 哦,2,2015/8/31,19:32
509453-22,509453,22,臺北醫學大學,m,2015年9月1日 01:51,楓杏 很累 辛苦 資源 很多 很靠杯 不可 否認 本魯 就是 忙不過來 才沒 留到 高年級 看不下去 那種 從來沒 加過 天天 旁邊 各種 詆毀 我也沒 跟系 不好 不熟 啊 zzz,13,2015/9/1,01:51
509453-23,509453,23,原PO - 臺北醫學大學 ,f,2015年9月1日 03:15,b21 謝謝 學姐 列入 名單,0,2015/9/1,03:15
509453-24,509453,24,原PO - 臺北醫學大學 ,f,2015年9月1日 03:17,b22 請問 那是 性質 社團,0,2015/9/1,03:17
509453-25,509453,25,臺北醫學大學,f,2015年9月1日 03:55,系 也有 楓杏 也都 不錯的 至於 楓杏 見仁見智 嘍 不過 一個 社團 大家 幹譙成 這樣 不會 原因,1,2015/9/1,03:55
509453-26,509453,26,臺北醫學大學 醫務管理學系,m,2015年9月1日 07:41,楓杏 只是 社會化 程度 較高 代表 之一 以前 康輔 也是 譙 社團 代表 學校 辦事 社團 本來 就會 這樣的 情況 講過 分些 很像 kmt 大概 僅 限於 權力 資源 畢竟 成果 值得 肯定 瘦宅 參與 過社評 全程 能說 有些 社團 內務 管 不好 還在 譙缺 根本是 眼紅 能力差 一定要 加入 可是 偶爾 瞭解 一下 做什麼 並非 壞事 連 社團 都沒 投入 沒 思考 酸 還是 先 閉嘴 瘦宅 楓杏 待了 四年 跟班 互動 還是 很好 除了 那種 只會 讀書 不問世事 族群 不過 否認 也是 會有 特例 這部份 自我 造化 回歸 正題 學校 附近 臨江 街 夜市 頗 推想 體驗 夜生活 威秀 一帶 夜店 體驗 只是 保護 莊敬路 上有 象山 運動 放閃 象山 捷運線 開通 以後 其實 捷運 方便 多 轉學生 其實 先 盡量 了解 班上 風氣 同學 除非 已經 決定 要當 獨行俠 融入 一個 已經 穩定的 班級 多少 困難 不知道 政府 大有為 政策 下校 內 工讀生 好不好 找 但是 適合 初期 顧好 校園 生活 加減 賺 靠自己 獨立的 可能 交友 課業 社團 必須 部份 犧牲 包子 小心 不要 啃 光了 hahaby 北醫 瘦宅,11,2015/9/1,07:41
509453-27,509453,27,臺北醫學大學 藥學系,f,2015年9月1日 08:26,轉學生 歡迎 轉聯 活動 認識 其他 轉系 轉學生 然 後轉 聯在 98 有為 轉學生 辦學 分 抵免 說明會 問題 那時 問臉 書 社團 搜尋 102103 轉系 轉學生 按 加入 裡面 更多 資訊 喔 問題 也可以 裡面 提出 相信 會有 一堆 搶 回答 xddd,4,2015/9/1,08:26
509453-28,509453,28,臺北醫學大學,m,2015年9月1日 12:08,拒絕 楓杏 啊,4,2015/9/1,12:08
509453-29,509453,29,臺北醫學大學,m,2015年9月1日 12:28,加入 北醫 山服 一生 滿滿 幸福,3,2015/9/1,12:28
509453-30,509453,30,原PO - 臺北醫學大學 ,f,2015年9月1日 13:29,b26 謝謝 瘦宅 學長 詳細 呀,0,2015/9/1,13:29
502514-1,502514,1,臺北醫學大學 醫務管理學系,m,2015年8月29日 11:13,推醫管 暖 男,8,2015/8/29,11:13
502514-2,502514,2,原PO - 臺北醫學大學,m,2015年8月29日 11:32,醫管 暖 男 目前 一票 差將 北醫 其他 男性 趴 後頭 男性 摩拳擦掌 北醫 女性 看來 還在 台下 較勁 她們 真的 甘心 默默無聞 嗎 敬請 期待,6,2015/8/29,11:32
502514-3,502514,3,臺北醫學大學 醫學系,m,2015年8月29日 12:19,推 沉思,22,2015/8/29,12:19
502514-4,502514,4,臺北醫學大學 醫務管理學系,f,2015年8月29日 13:00,推醫管 暖 男,6,2015/8/29,13:00
502514-5,502514,5,臺北醫學大學 醫務管理學系,m,2015年8月29日 13:07,推暖 男 單身 徵婆會 音樂 佳 愛 游泳 更佳 放屁 臭 直接 娶 回家,22,2015/8/29,13:07
502514-6,502514,6,臺北醫學大學 醫務管理學系,m,2015年8月29日 13:49,樓上 到底 是誰,5,2015/8/29,13:49
502514-7,502514,7,臺北醫學大學,m,2015年8月29日 17:06,校草 草 豬籠草 嗎,6,2015/8/29,17:06
502514-8,502514,8,臺北醫學大學 護理學系,f,2015年8月30日 01:41,推 b3 沉思,6,2015/8/30,01:41
502514-9,502514,9,臺北醫學大學 醫務管理學系,f,2015年8月30日 04:06,推 北醫 暖 男 冬天 來臨 前 暖 一波 xd,6,2015/8/30,04:06
502514-10,502514,10,原PO - 臺北醫學大學,m,2015年8月30日 14:21,沉思 有所 ㄕ 暖 男 到底有 多暖 豬籠草 店店 吃 三碗 公 到底 誰 勝出 是否 半路 程咬金 戰局 棘手 敬請 期待,7,2015/8/30,14:21
502514-11,502514,11,臺北醫學大學 醫務管理學系,m,2015年8月31日 05:53,聽說 醫管 暖 男 三天 洗 一次 澡,8,2015/8/31,05:53
502514-12,502514,12,臺北醫學大學 護理學系,f,2015年8月31日 07:39,前衛,2,2015/8/31,07:39
502514-13,502514,13,原PO - 臺北醫學大學,m,2015年9月4日 15:30,暑出 社研 迎新 準備 大概 告一段落 該來 參 加個 校花 校草 選拔 xd 課指組 女神 提個 名,1,2015/9/4,15:30
502514-14,502514,14,臺北醫學大學,f,2015年9月5日 14:42,北醫 阿 喵 參選,1,2015/9/5,14:42
502514-15,502514,15,臺北醫學大學,m,2015年9月16日 06:49,醫管 看起來 弱不禁風 健身房 都在 聊天 快 笑死,1,2015/9/16,06:49
502514-16,502514,16,一個把回應刪除的同學,o,2015年9月16日 10:57,已經 刪除 內容 就像 dcard 一樣 錯過 無法 相見,0,2015/9/16,10:57
502514-17,502514,17,臺北醫學大學,m,2015年9月16日 10:58,b15 不要 醫管 連系 都不敢 留 我看 大概 只會在 網路上 打嘴 炮 不知道 健身房 笑死,2,2015/9/16,10:58
502514-18,502514,18,臺北醫學大學 醫務管理學系,m,2015年9月16日 17:12,醫管 真的 娘 歪歪 我自己 就醫 管 覺得 別系 肌肌 棒棒,1,2015/9/16,17:12
502514-19,502514,19,一個把回應刪除的同學,o,2015年9月17日 01:23,已經 刪除 內容 就像 dcard 一樣 錯過 無法 相見,0,2015/9/17,01:23
502514-20,502514,20,原PO - 臺北醫學大學,m,2015年9月18日 10:09,b15b17 等到 921 健身房 開啟 就來 尋找 傳說中 衣管 暖 男,1,2015/9/18,10:09
502514-21,502514,21,臺北醫學大學 醫務管理學系,f,2015年9月18日 18:36,先 別說 大肌 肌 有吃 過小 阿姨 嗎,8,2015/9/18,18:36
502514-22,502514,22,臺北醫學大學,m,6月15日 12:28,,0,2016/6/15,12:28
496416-1,496416,1,臺北醫學大學 醫學檢驗暨生物技術學系,m,2015年8月27日 16:28,倒是 一直 沒 遇到 北醫,4,2015/8/27,16:28
496416-2,496416,2,臺北醫學大學,f,2015年8月27日 16:41,我也 剛辦 大概 一個 禮拜 真的 抽到 好多 同校 欸,3,2015/8/27,16:41
496416-3,496416,3,臺北醫學大學,m,2015年8月27日 16:54,我也 剛辦 6 張 裡面 3 張是 北醫,2,2015/8/27,16:54
496416-4,496416,4,臺北醫學大學,f,2015年8月27日 17:00,我也 一直 抽到 同校 xd,2,2015/8/27,17:00
496416-5,496416,5,臺北醫學大學 保健營養學系,m,2015年8月27日 17:41,最近 好像 很常 抽到 同校 欸 加倍 有感 我是 保健 四 學長 有沒有 保 ㄧ 認親 一下 滷 唐,4,2015/8/27,17:41
496416-6,496416,6,臺北醫學大學 牙醫學系,m,2015年8月27日 17:47,反而 沒 同校 xd,5,2015/8/27,17:47
496416-7,496416,7,臺北醫學大學 護理學系,f,2015年8月28日 00:07,我也是 耶 xdd 大概 前 兩個 星期 已經有 5,2,2015/8/28,00:07
496416-8,496416,8,臺北醫學大學 醫學檢驗暨生物技術學系,m,2015年8月28日 00:36,之前 兩天 一個 啊 這週 已經 連 4 張了 米糠,3,2015/8/28,00:36
496416-9,496416,9,臺北醫學大學 醫學系,m,2015年8月28日 02:43,我也 連 四張 到底,2,2015/8/28,02:43
